{
  "$schema": "https://json-schema.org/draft/2020-12/schema",
  "$id": "https://vibecode.local/content-schemas/npc.json",
  "title": "npc_definition",
  "type": "object",
  "additionalProperties": false,
  "required": [
    "id",
    "kind",
    "displayName",
    "displayNameKey",
    "visualId",
    "zoneId",
    "position",
    "homePosition",
    "routeId",
    "interactionRange",
    "dialogueId",
    "services"
  ],
  "properties": {
    "id": { "$ref": "https://vibecode.local/content-schemas/common.json#/$defs/contentId" },
    "kind": { "const": "npc" },
    "displayName": { "type": "string", "minLength": 1 },
    "displayNameKey": { "type": "string", "minLength": 1 },
    "visualId": { "$ref": "https://vibecode.local/content-schemas/common.json#/$defs/contentId" },
    "zoneId": { "$ref": "https://vibecode.local/content-schemas/common.json#/$defs/contentId" },
    "position": { "$ref": "https://vibecode.local/content-schemas/common.json#/$defs/vec2" },
    "homePosition": { "$ref": "https://vibecode.local/content-schemas/common.json#/$defs/vec2" },
    "routeId": { "$ref": "https://vibecode.local/content-schemas/common.json#/$defs/contentId" },
    "interactionRange": { "$ref": "https://vibecode.local/content-schemas/common.json#/$defs/positiveNumber" },
    "dialogueId": { "$ref": "https://vibecode.local/content-schemas/common.json#/$defs/contentId" },
    "services": {
      "type": "array",
      "minItems": 1,
      "items": { "$ref": "https://vibecode.local/content-schemas/npc_service_binding.json" }
    },
    "schemaVersion": { "$ref": "https://vibecode.local/content-schemas/common.json#/$defs/definitionSchemaVersion" },
    "developmentOnly": { "$ref": "https://vibecode.local/content-schemas/common.json#/$defs/developmentOnly" }
  }
}
