{
  "id": "npc.test_cave_portal",
  "kind": "npc",
  "displayName": "Test Cave Portal",
  "displayNameKey": "npc.test_cave_portal.name",
  "visualId": "visual.npc_cave_portal",
  "zoneId": "zone.starter",
  "position": { "x": 1720, "y": 1664 },
  "homePosition": { "x": 1720, "y": 1664 },
  "routeId": "route.stationary",
  "interactionRange": 48,
  "dialogueId": "dialogue.npc.test_cave_portal",
  "services": [
    { "type": "dialogue" },
    { "type": "cave_entrance" }
  ]
}
