{
  "id": "npc.proof_giver",
  "kind": "npc",
  "displayName": "Proof Giver",
  "displayNameKey": "npc.proof_giver.name",
  "visualId": "visual.npc_proof_giver",
  "zoneId": "zone.starter",
  "position": { "x": 1880, "y": 1664 },
  "homePosition": { "x": 1880, "y": 1664 },
  "routeId": "route.stationary",
  "interactionRange": 48,
  "dialogueId": "dialogue.npc.proof_giver",
  "services": [
    { "type": "dialogue" },
    { "type": "quest_offer", "questIds": ["quest.proof_errand"] },
    { "type": "quest_turn_in", "questIds": ["quest.proof_errand"] }
  ]
}
