{
  "id": "npc.platform_merchant",
  "kind": "npc",
  "displayName": "Platform Merchant",
  "displayNameKey": "npc.platform_merchant.name",
  "visualId": "visual.npc_platform_merchant",
  "zoneId": "zone.starter",
  "position": { "x": 1480, "y": 1784 },
  "homePosition": { "x": 1480, "y": 1784 },
  "routeId": "route.stationary",
  "interactionRange": 48,
  "dialogueId": "dialogue.npc.platform_merchant",
  "services": [
    { "type": "dialogue" },
    { "type": "vendor", "vendorId": "vendor.platform_kiosk" }
  ]
}
