{
  "id": "npc.test_vendor",
  "kind": "npc",
  "displayName": "Test Vendor",
  "displayNameKey": "npc.test_vendor.name",
  "visualId": "visual.npc_vendor",
  "zoneId": "zone.starter",
  "position": { "x": 1360, "y": 1664 },
  "homePosition": { "x": 1360, "y": 1664 },
  "routeId": "route.stationary",
  "interactionRange": 48,
  "dialogueId": "dialogue.npc.test_vendor",
  "services": [
    { "type": "dialogue" },
    { "type": "vendor", "vendorId": "vendor.test_general" }
  ]
}
